{
  "smp_version": "0.2",
  "profile": "standard",
  "intent": {
    "summary": "Turn a rough human idea into a concise X reply about SMP's next practical step.",
    "priority": "clarity and momentum",
    "success_condition": "The reply explains that SMP is moving from concept to a small open protocol bridge."
  },
  "context": {
    "project": "SMP - Semantic Multiplex Protocol",
    "current_stage": "public v0.2 draft",
    "platform": "X",
    "github": "https://github.com/Krugers123/SMP"
  },
  "constraints": {
    "length": "short enough for an X reply",
    "language": "English",
    "avoid": ["long theory", "overclaims", "private implementation details"]
  },
  "tone": {
    "style": "clear, optimistic, grounded",
    "energy": "builder mode"
  },
  "risk_watch": {
    "watch_for": ["sounding like a prompt wrapper", "claiming safety guarantees", "too much hype"]
  },
  "boundaries": {
    "must_not": [
      "claim SMP solves alignment",
      "imply model weight modification",
      "imply autonomous control"
    ]
  },
  "trajectory": {
    "preserve": "SMP as a non-invasive semantic bandwidth layer between humans and AI"
  },
  "desired_output": {
    "format": "short reply with GitHub link",
    "audience": "AI builders and curious X readers",
    "detail_level": "brief"
  },
  "memory_hooks": {
    "core_line": "The next bottleneck may be semantic bandwidth between humans and AI."
  },
  "metadata": {
    "packet_id": "example-chatgpt-bridge-v0",
    "source": "SMP public examples"
  }
}
